<?xml version="1.0" encoding="UTF-8"?>
<!DOCTYPE root [
        <!ENTITY Aacute           "&#x000C1;" >
        <!ENTITY aacute           "&#x000E1;" >
        <!ENTITY Acirc            "&#x000C2;" >
        <!ENTITY acirc            "&#x000E2;" >
        <!ENTITY acute            "&#x000B4;" >
        <!ENTITY AElig            "&#x000C6;" >
        <!ENTITY aelig            "&#x000E6;" >
        <!ENTITY Agrave           "&#x000C0;" >
        <!ENTITY agrave           "&#x000E0;" >
        <!ENTITY Aring            "&#x000C5;" >
        <!ENTITY aring            "&#x000E5;" >
        <!ENTITY Atilde           "&#x000C3;" >
        <!ENTITY atilde           "&#x000E3;" >
        <!ENTITY Auml             "&#x000C4;" >
        <!ENTITY auml             "&#x000E4;" >
        <!ENTITY brvbar           "&#x000A6;" >
        <!ENTITY Ccedil           "&#x000C7;" >
        <!ENTITY ccedil           "&#x000E7;" >
        <!ENTITY cedil            "&#x000B8;" >
        <!ENTITY cent             "&#x000A2;" >
        <!ENTITY copy             "&#x000A9;" >
        <!ENTITY curren           "&#x000A4;" >
        <!ENTITY deg              "&#x000B0;" >
        <!ENTITY divide           "&#x000F7;" >
        <!ENTITY Eacute           "&#x000C9;" >
        <!ENTITY eacute           "&#x000E9;" >
        <!ENTITY Ecirc            "&#x000CA;" >
        <!ENTITY ecirc            "&#x000EA;" >
        <!ENTITY Egrave           "&#x000C8;" >
        <!ENTITY egrave           "&#x000E8;" >
        <!ENTITY ETH              "&#x000D0;" >
        <!ENTITY eth              "&#x000F0;" >
        <!ENTITY Euml             "&#x000CB;" >
        <!ENTITY euml             "&#x000EB;" >
        <!ENTITY frac12           "&#x000BD;" >
        <!ENTITY frac14           "&#x000BC;" >
        <!ENTITY frac34           "&#x000BE;" >
        <!ENTITY Iacute           "&#x000CD;" >
        <!ENTITY iacute           "&#x000ED;" >
        <!ENTITY Icirc            "&#x000CE;" >
        <!ENTITY icirc            "&#x000EE;" >
        <!ENTITY iexcl            "&#x000A1;" >
        <!ENTITY Igrave           "&#x000CC;" >
        <!ENTITY igrave           "&#x000EC;" >
        <!ENTITY iquest           "&#x000BF;" >
        <!ENTITY Iuml             "&#x000CF;" >
        <!ENTITY iuml             "&#x000EF;" >
        <!ENTITY laquo            "&#x000AB;" >
        <!ENTITY macr             "&#x000AF;" >
        <!ENTITY micro            "&#x000B5;" >
        <!ENTITY middot           "&#x000B7;" >
        <!ENTITY nbsp             "&#x000A0;" >
        <!ENTITY not              "&#x000AC;" >
        <!ENTITY Ntilde           "&#x000D1;" >
        <!ENTITY ntilde           "&#x000F1;" >
        <!ENTITY Oacute           "&#x000D3;" >
        <!ENTITY oacute           "&#x000F3;" >
        <!ENTITY Ocirc            "&#x000D4;" >
        <!ENTITY ocirc            "&#x000F4;" >
        <!ENTITY Ograve           "&#x000D2;" >
        <!ENTITY ograve           "&#x000F2;" >
        <!ENTITY ordf             "&#x000AA;" >
        <!ENTITY ordm             "&#x000BA;" >
        <!ENTITY Oslash           "&#x000D8;" >
        <!ENTITY oslash           "&#x000F8;" >
        <!ENTITY Otilde           "&#x000D5;" >
        <!ENTITY otilde           "&#x000F5;" >
        <!ENTITY Ouml             "&#x000D6;" >
        <!ENTITY ouml             "&#x000F6;" >
        <!ENTITY para             "&#x000B6;" >
        <!ENTITY plusmn           "&#x000B1;" >
        <!ENTITY pound            "&#x000A3;" >
        <!ENTITY raquo            "&#x000BB;" >
        <!ENTITY reg              "&#x000AE;" >
        <!ENTITY sect             "&#x000A7;" >
        <!ENTITY shy              "&#x000AD;" >
        <!ENTITY sup1             "&#x000B9;" >
        <!ENTITY sup2             "&#x000B2;" >
        <!ENTITY sup3             "&#x000B3;" >
        <!ENTITY szlig            "&#x000DF;" >
        <!ENTITY THORN            "&#x000DE;" >
        <!ENTITY thorn            "&#x000FE;" >
        <!ENTITY times            "&#x000D7;" >
        <!ENTITY Uacute           "&#x000DA;" >
        <!ENTITY uacute           "&#x000FA;" >
        <!ENTITY Ucirc            "&#x000DB;" >
        <!ENTITY ucirc            "&#x000FB;" >
        <!ENTITY Ugrave           "&#x000D9;" >
        <!ENTITY ugrave           "&#x000F9;" >
        <!ENTITY uml              "&#x000A8;" >
        <!ENTITY Uuml             "&#x000DC;" >
        <!ENTITY uuml             "&#x000FC;" >
        <!ENTITY Yacute           "&#x000DD;" >
        <!ENTITY yacute           "&#x000FD;" >
        <!ENTITY yen              "&#x000A5;" >
        <!ENTITY yuml             "&#x000FF;" >
        <!ELEMENT root          (error*,npadata*)>
        <!ELEMENT error         (#PCDATA)>
        <!ELEMENT inputdata     (npa?,region?)>
        <!ELEMENT npadata       (npa,region,rname,overlay)>
        <!ELEMENT npa           (#PCDATA)>
        <!ELEMENT region        (#PCDATA)>
        <!ELEMENT rname         (#PCDATA)>
        <!ELEMENT overlay       (#PCDATA)>
        ]>
<root>
    <inputdata>
    </inputdata>
    <npadata>
        <npa>201</npa>
        <region>NJ</region>
        <rname>New Jersey</rname>
        <overlay>201/551</overlay>
    </npadata>
    <npadata>
        <npa>202</npa>
        <region>DC</region>
        <rname>District of Columbia</rname>
        <overlay></overlay>
    </npadata>
    <npadata>
        <npa>203</npa>
        <region>CT</region>
        <rname>Connecticut</rname>
        <overlay>203/475</overlay>
    </npadata>
    <npadata>
        <npa>204</npa>
        <region>MB</region>
        <rname>Manitoba</rname>
        <overlay>204/431</overlay>
    </npadata>
    <npadata>
        <npa>205</npa>
        <region>AL</region>
        <rname>Alabama</rname>
        <overlay>205/659</overlay>
    </npadata>
    <npadata>
        <npa>206</npa>
        <region>WA</region>
        <rname>Washington</rname>
        <overlay></overlay>
    </npadata>
    <npadata>
        <npa>207</npa>
        <region>ME</region>
        <rname>Maine</rname>
        <overlay></overlay>
    </npadata>
    <npadata>
        <npa>208</npa>
        <region>ID</region>
        <rname>Idaho</rname>
        <overlay>208/986</overlay>
    </npadata>
    <npadata>
        <npa>209</npa>
        <region>CA</region>
        <rname>California</rname>
        <overlay></overlay>
    </npadata>
    <npadata>
        <npa>210</npa>
        <region>TX</region>
        <rname>Texas</rname>
        <overlay>210/726</overlay>
    </npadata>
    <npadata>
        <npa>212</npa>
        <region>NY</region>
        <rname>New York</rname>
        <overlay>212/332/646/917</overlay>
    </npadata>
    <npadata>
        <npa>213</npa>
        <region>CA</region>
        <rname>California</rname>
        <overlay>213/323</overlay>
    </npadata>
    <npadata>
        <npa>214</npa>
        <region>TX</region>
        <rname>Texas</rname>
        <overlay>214/469/972</overlay>
    </npadata>
    <npadata>
        <npa>215</npa>
        <region>PA</region>
        <rname>Pennsylvania</rname>
        <overlay>215/267/445</overlay>
    </npadata>
    <npadata>
        <npa>216</npa>
        <region>OH</region>
        <rname>Ohio</rname>
        <overlay></overlay>
    </npadata>
    <npadata>
        <npa>217</npa>
        <region>IL</region>
        <rname>Illinois</rname>
        <overlay>217/447</overlay>
    </npadata>
    <npadata>
        <npa>218</npa>
        <region>MN</region>
        <rname>Minnesota</rname>
        <overlay></overlay>
    </npadata>
    <npadata>
        <npa>219</npa>
        <region>IN</region>
        <rname>Indiana</rname>
        <overlay></overlay>
    </npadata>
    <npadata>
        <npa>220</npa>
        <region>OH</region>
        <rname>Ohio</rname>
        <overlay>220/740</overlay>
    </npadata>
    <npadata>
        <npa>223</npa>
        <region>PA</region>
        <rname>Pennsylvania</rname>
        <overlay>223/717</overlay>
    </npadata>
    <npadata>
        <npa>224</npa>
        <region>IL</region>
        <rname>Illinois</rname>
        <overlay>224/847</overlay>
    </npadata>
    <npadata>
        <npa>225</npa>
        <region>LA</region>
        <rname>Louisiana</rname>
        <overlay></overlay>
    </npadata>
    <npadata>
        <npa>226</npa>
        <region>ON</region>
        <rname>Ontario</rname>
        <overlay>226/519/548</overlay>
    </npadata>
    <npadata>
        <npa>227</npa>
        <region>MD</region>
        <rname>Maryland</rname>
        <overlay>227/240/301</overlay>
    </npadata>
    <npadata>
        <npa>228</npa>
        <region>MS</region>
        <rname>Mississippi</rname>
        <overlay></overlay>
    </npadata>
    <npadata>
        <npa>229</npa>
        <region>GA</region>
        <rname>Georgia</rname>
        <overlay></overlay>
    </npadata>
    <npadata>
        <npa>231</npa>
        <region>MI</region>
        <rname>Michigan</rname>
        <overlay></overlay>
    </npadata>
    <npadata>
        <npa>234</npa>
        <region>OH</region>
        <rname>Ohio</rname>
        <overlay>234/330</overlay>
    </npadata>
    <npadata>
        <npa>236</npa>
        <region>BC</region>
        <rname>British Columbia</rname>
        <overlay>236/250/672/778; 236/604/672/778</overlay>
    </npadata>
    <npadata>
        <npa>239</npa>
        <region>FL</region>
        <rname>Florida</rname>
        <overlay></overlay>
    </npadata>
    <npadata>
        <npa>240</npa>
        <region>MD</region>
        <rname>Maryland</rname>
        <overlay>227/240/301</overlay>
    </npadata>
    <npadata>
        <npa>242</npa>
        <region>BA</region>
        <rname>Bahamas</rname>
        <overlay></overlay>
    </npadata>
    <npadata>
        <npa>246</npa>
        <region>BD</region>
        <rname>Barbados</rname>
        <overlay></overlay>
    </npadata>
    <npadata>
        <npa>248</npa>
        <region>MI</region>
        <rname>Michigan</rname>
        <overlay>248/947</overlay>
    </npadata>
    <npadata>
        <npa>249</npa>
        <region>ON</region>
        <rname>Ontario</rname>
        <overlay>249/705</overlay>
    </npadata>
    <npadata>
        <npa>250</npa>
        <region>BC</region>
        <rname>British Columbia</rname>
        <overlay>236/250/672/778</overlay>
    </npadata>
    <npadata>
        <npa>251</npa>
        <region>AL</region>
        <rname>Alabama</rname>
        <overlay></overlay>
    </npadata>
    <npadata>
        <npa>252</npa>
        <region>NC</region>
        <rname>North Carolina</rname>
        <overlay></overlay>
    </npadata>
    <npadata>
        <npa>253</npa>
        <region>WA</region>
        <rname>Washington</rname>
        <overlay></overlay>
    </npadata>
    <npadata>
        <npa>254</npa>
        <region>TX</region>
        <rname>Texas</rname>
        <overlay></overlay>
    </npadata>
    <npadata>
        <npa>256</npa>
        <region>AL</region>
        <rname>Alabama</rname>
        <overlay>256/938</overlay>
    </npadata>
    <npadata>
        <npa>260</npa>
        <region>IN</region>
        <rname>Indiana</rname>
        <overlay></overlay>
    </npadata>
    <npadata>
        <npa>262</npa>
        <region>WI</region>
        <rname>Wisconsin</rname>
        <overlay></overlay>
    </npadata>
    <npadata>
        <npa>264</npa>
        <region>AI</region>
        <rname>Anguilla</rname>
        <overlay></overlay>
    </npadata>
    <npadata>
        <npa>267</npa>
        <region>PA</region>
        <rname>Pennsylvania</rname>
        <overlay>215/267/445</overlay>
    </npadata>
    <npadata>
        <npa>268</npa>
        <region>AN</region>
        <rname>Antigua and Barbuda</rname>
        <overlay></overlay>
    </npadata>
    <npadata>
        <npa>269</npa>
        <region>MI</region>
        <rname>Michigan</rname>
        <overlay></overlay>
    </npadata>
    <npadata>
        <npa>270</npa>
        <region>KY</region>
        <rname>Kentucky</rname>
        <overlay>270/364</overlay>
    </npadata>
    <npadata>
        <npa>272</npa>
        <region>PA</region>
        <rname>Pennsylvania</rname>
        <overlay>272/570</overlay>
    </npadata>
    <npadata>
        <npa>274</npa>
        <region>WI</region>
        <rname>Wisconsin</rname>
        <overlay>274/920</overlay>
    </npadata>
    <npadata>
        <npa>276</npa>
        <region>VA</region>
        <rname>Virginia</rname>
        <overlay></overlay>
    </npadata>
    <npadata>
        <npa>279</npa>
        <region>CA</region>
        <rname>California</rname>
        <overlay>279/916</overlay>
    </npadata>
    <npadata>
        <npa>281</npa>
        <region>TX</region>
        <rname>Texas</rname>
        <overlay>281/346/713/832</overlay>
    </npadata>
    <npadata>
        <npa>283</npa>
        <region>OH</region>
        <rname>Ohio</rname>
        <overlay>513/283</overlay>
    </npadata>
    <npadata>
        <npa>284</npa>
        <region>BV</region>
        <rname>British Virgin Islands</rname>
        <overlay></overlay>
    </npadata>
    <npadata>
        <npa>289</npa>
        <region>ON</region>
        <rname>Ontario</rname>
        <overlay>289/365/905</overlay>
    </npadata>
    <npadata>
        <npa>301</npa>
        <region>MD</region>
        <rname>Maryland</rname>
        <overlay>227/240/301</overlay>
    </npadata>
    <npadata>
        <npa>302</npa>
        <region>DE</region>
        <rname>Delaware</rname>
        <overlay></overlay>
    </npadata>
    <npadata>
        <npa>303</npa>
        <region>CO</region>
        <rname>Colorado</rname>
        <overlay>303/720</overlay>
    </npadata>
    <npadata>
        <npa>304</npa>
        <region>WV</region>
        <rname>West Virginia</rname>
        <overlay>304/681</overlay>
    </npadata>
    <npadata>
        <npa>305</npa>
        <region>FL</region>
        <rname>Florida</rname>
        <overlay>305/786</overlay>
    </npadata>
    <npadata>
        <npa>306</npa>
        <region>SK</region>
        <rname>Saskatchewan</rname>
        <overlay>306/639</overlay>
    </npadata>
    <npadata>
        <npa>307</npa>
        <region>WY</region>
        <rname>Wyoming</rname>
        <overlay></overlay>
    </npadata>
    <npadata>
        <npa>308</npa>
        <region>NE</region>
        <rname>Nebraska</rname>
        <overlay></overlay>
    </npadata>
    <npadata>
        <npa>309</npa>
        <region>IL</region>
        <rname>Illinois</rname>
        <overlay></overlay>
    </npadata>
    <npadata>
        <npa>310</npa>
        <region>CA</region>
        <rname>California</rname>
        <overlay>310/424</overlay>
    </npadata>
    <npadata>
        <npa>312</npa>
        <region>IL</region>
        <rname>Illinois</rname>
        <overlay>312/872</overlay>
    </npadata>
    <npadata>
        <npa>313</npa>
        <region>MI</region>
        <rname>Michigan</rname>
        <overlay>313/679</overlay>
    </npadata>
    <npadata>
        <npa>314</npa>
        <region>MO</region>
        <rname>Missouri</rname>
        <overlay>314/557</overlay>
    </npadata>
    <npadata>
        <npa>315</npa>
        <region>NY</region>
        <rname>New York</rname>
        <overlay>315/680</overlay>
    </npadata>
    <npadata>
        <npa>316</npa>
        <region>KS</region>
        <rname>Kansas</rname>
        <overlay></overlay>
    </npadata>
    <npadata>
        <npa>317</npa>
        <region>IN</region>
        <rname>Indiana</rname>
        <overlay>317/463</overlay>
    </npadata>
    <npadata>
        <npa>318</npa>
        <region>LA</region>
        <rname>Louisiana</rname>
        <overlay></overlay>
    </npadata>
    <npadata>
        <npa>319</npa>
        <region>IA</region>
        <rname>Iowa</rname>
        <overlay></overlay>
    </npadata>
    <npadata>
        <npa>320</npa>
        <region>MN</region>
        <rname>Minnesota</rname>
        <overlay></overlay>
    </npadata>
    <npadata>
        <npa>321</npa>
        <region>FL</region>
        <rname>Florida</rname>
        <overlay>321/407/689</overlay>
    </npadata>
    <npadata>
        <npa>323</npa>
        <region>CA</region>
        <rname>California</rname>
        <overlay>213/323</overlay>
    </npadata>
    <npadata>
        <npa>325</npa>
        <region>TX</region>
        <rname>Texas</rname>
        <overlay></overlay>
    </npadata>
    <npadata>
        <npa>326</npa>
        <region>OH</region>
        <rname>Ohio</rname>
        <overlay>326/937</overlay>
    </npadata>
    <npadata>
        <npa>327</npa>
        <region>AR</region>
        <rname>Arkansas</rname>
        <overlay>327/870</overlay>
    </npadata>
    <npadata>
        <npa>330</npa>
        <region>OH</region>
        <rname>Ohio</rname>
        <overlay>234/330</overlay>
    </npadata>
    <npadata>
        <npa>331</npa>
        <region>IL</region>
        <rname>Illinois</rname>
        <overlay>331/630</overlay>
    </npadata>
    <npadata>
        <npa>332</npa>
        <region>NY</region>
        <rname>New York</rname>
        <overlay>212/332/646/917</overlay>
    </npadata>
    <npadata>
        <npa>334</npa>
        <region>AL</region>
        <rname>Alabama</rname>
        <overlay></overlay>
    </npadata>
    <npadata>
        <npa>336</npa>
        <region>NC</region>
        <rname>North Carolina</rname>
        <overlay>336/743</overlay>
    </npadata>
    <npadata>
        <npa>337</npa>
        <region>LA</region>
        <rname>Louisiana</rname>
        <overlay></overlay>
    </npadata>
    <npadata>
        <npa>339</npa>
        <region>MA</region>
        <rname>Massachusetts</rname>
        <overlay>339/781</overlay>
    </npadata>
    <npadata>
        <npa>340</npa>
        <region>VI</region>
        <rname>US Virgin Islands</rname>
        <overlay></overlay>
    </npadata>
    <npadata>
        <npa>341</npa>
        <region>CA</region>
        <rname>California</rname>
        <overlay>341/510</overlay>
    </npadata>
    <npadata>
        <npa>343</npa>
        <region>ON</region>
        <rname>Ontario</rname>
        <overlay>343/613</overlay>
    </npadata>
    <npadata>
        <npa>343</npa>
        <region>QC</region>
        <rname>Québec</rname>
        <overlay>343/613</overlay>
    </npadata>
    <npadata>
        <npa>345</npa>
        <region>CQ</region>
        <rname>Cayman Islands</rname>
        <overlay></overlay>
    </npadata>
    <npadata>
        <npa>346</npa>
        <region>TX</region>
        <rname>Texas</rname>
        <overlay>281/346/713/832</overlay>
    </npadata>
    <npadata>
        <npa>347</npa>
        <region>NY</region>
        <rname>New York</rname>
        <overlay>347/718/917/929</overlay>
    </npadata>
    <npadata>
        <npa>351</npa>
        <region>MA</region>
        <rname>Massachusetts</rname>
        <overlay>351/978</overlay>
    </npadata>
    <npadata>
        <npa>352</npa>
        <region>FL</region>
        <rname>Florida</rname>
        <overlay></overlay>
    </npadata>
    <npadata>
        <npa>360</npa>
        <region>WA</region>
        <rname>Washington</rname>
        <overlay>360/564</overlay>
    </npadata>
    <npadata>
        <npa>361</npa>
        <region>TX</region>
        <rname>Texas</rname>
        <overlay></overlay>
    </npadata>
    <npadata>
        <npa>364</npa>
        <region>KY</region>
        <rname>Kentucky</rname>
        <overlay>270/364</overlay>
    </npadata>
    <npadata>
        <npa>365</npa>
        <region>ON</region>
        <rname>Ontario</rname>
        <overlay>289/365/905</overlay>
    </npadata>
    <npadata>
        <npa>367</npa>
        <region>QC</region>
        <rname>Québec</rname>
        <overlay>367/418/581</overlay>
    </npadata>
    <npadata>
        <npa>380</npa>
        <region>OH</region>
        <rname>Ohio</rname>
        <overlay>380/614</overlay>
    </npadata>
    <npadata>
        <npa>385</npa>
        <region>UT</region>
        <rname>Utah</rname>
        <overlay>385/801</overlay>
    </npadata>
    <npadata>
        <npa>386</npa>
        <region>FL</region>
        <rname>Florida</rname>
        <overlay></overlay>
    </npadata>
    <npadata>
        <npa>401</npa>
        <region>RI</region>
        <rname>Rhode Island</rname>
        <overlay></overlay>
    </npadata>
    <npadata>
        <npa>402</npa>
        <region>NE</region>
        <rname>Nebraska</rname>
        <overlay>402/531</overlay>
    </npadata>
    <npadata>
        <npa>403</npa>
        <region>AB</region>
        <rname>Alberta</rname>
        <overlay>403/587/825</overlay>
    </npadata>
    <npadata>
        <npa>404</npa>
        <region>GA</region>
        <rname>Georgia</rname>
        <overlay>404/470/678</overlay>
    </npadata>
    <npadata>
        <npa>405</npa>
        <region>OK</region>
        <rname>Oklahoma</rname>
        <overlay></overlay>
    </npadata>
    <npadata>
        <npa>406</npa>
        <region>MT</region>
        <rname>Montana</rname>
        <overlay></overlay>
    </npadata>
    <npadata>
        <npa>407</npa>
        <region>FL</region>
        <rname>Florida</rname>
        <overlay>321/407/689</overlay>
    </npadata>
    <npadata>
        <npa>408</npa>
        <region>CA</region>
        <rname>California</rname>
        <overlay>408/669</overlay>
    </npadata>
    <npadata>
        <npa>409</npa>
        <region>TX</region>
        <rname>Texas</rname>
        <overlay></overlay>
    </npadata>
    <npadata>
        <npa>410</npa>
        <region>MD</region>
        <rname>Maryland</rname>
        <overlay>410/443/667</overlay>
    </npadata>
    <npadata>
        <npa>412</npa>
        <region>PA</region>
        <rname>Pennsylvania</rname>
        <overlay>412/878</overlay>
    </npadata>
    <npadata>
        <npa>413</npa>
        <region>MA</region>
        <rname>Massachusetts</rname>
        <overlay></overlay>
    </npadata>
    <npadata>
        <npa>414</npa>
        <region>WI</region>
        <rname>Wisconsin</rname>
        <overlay></overlay>
    </npadata>
    <npadata>
        <npa>415</npa>
        <region>CA</region>
        <rname>California</rname>
        <overlay>415/628</overlay>
    </npadata>
    <npadata>
        <npa>416</npa>
        <region>ON</region>
        <rname>Ontario</rname>
        <overlay>416/437/647</overlay>
    </npadata>
    <npadata>
        <npa>417</npa>
        <region>MO</region>
        <rname>Missouri</rname>
        <overlay></overlay>
    </npadata>
    <npadata>
        <npa>418</npa>
        <region>QC</region>
        <rname>Québec</rname>
        <overlay>367/418/581</overlay>
    </npadata>
    <npadata>
        <npa>419</npa>
        <region>OH</region>
        <rname>Ohio</rname>
        <overlay>419/567</overlay>
    </npadata>
    <npadata>
        <npa>423</npa>
        <region>TN</region>
        <rname>Tennessee</rname>
        <overlay></overlay>
    </npadata>
    <npadata>
        <npa>424</npa>
        <region>CA</region>
        <rname>California</rname>
        <overlay>310/424</overlay>
    </npadata>
    <npadata>
        <npa>425</npa>
        <region>WA</region>
        <rname>Washington</rname>
        <overlay></overlay>
    </npadata>
    <npadata>
        <npa>428</npa>
        <region>NB</region>
        <rname>New Brunswick</rname>
        <overlay>428/506</overlay>
    </npadata>
    <npadata>
        <npa>430</npa>
        <region>TX</region>
        <rname>Texas</rname>
        <overlay>430/903</overlay>
    </npadata>
    <npadata>
        <npa>431</npa>
        <region>MB</region>
        <rname>Manitoba</rname>
        <overlay>204/431</overlay>
    </npadata>
    <npadata>
        <npa>432</npa>
        <region>TX</region>
        <rname>Texas</rname>
        <overlay></overlay>
    </npadata>
    <npadata>
        <npa>434</npa>
        <region>VA</region>
        <rname>Virginia</rname>
        <overlay></overlay>
    </npadata>
    <npadata>
        <npa>435</npa>
        <region>UT</region>
        <rname>Utah</rname>
        <overlay></overlay>
    </npadata>
    <npadata>
        <npa>437</npa>
        <region>ON</region>
        <rname>Ontario</rname>
        <overlay>416/437/647</overlay>
    </npadata>
    <npadata>
        <npa>438</npa>
        <region>QC</region>
        <rname>Québec</rname>
        <overlay>438/514</overlay>
    </npadata>
    <npadata>
        <npa>440</npa>
        <region>OH</region>
        <rname>Ohio</rname>
        <overlay></overlay>
    </npadata>
    <npadata>
        <npa>441</npa>
        <region>BM</region>
        <rname>Bermuda</rname>
        <overlay></overlay>
    </npadata>
    <npadata>
        <npa>442</npa>
        <region>CA</region>
        <rname>California</rname>
        <overlay>442/760</overlay>
    </npadata>
    <npadata>
        <npa>443</npa>
        <region>MD</region>
        <rname>Maryland</rname>
        <overlay>410/443/667</overlay>
    </npadata>
    <npadata>
        <npa>445</npa>
        <region>PA</region>
        <rname>Pennsylvania</rname>
        <overlay>215/267/445</overlay>
    </npadata>
    <npadata>
        <npa>447</npa>
        <region>IL</region>
        <rname>Illinois</rname>
        <overlay>217/447</overlay>
    </npadata>
    <npadata>
        <npa>450</npa>
        <region>QC</region>
        <rname>Québec</rname>
        <overlay>450/579</overlay>
    </npadata>
    <npadata>
        <npa>458</npa>
        <region>OR</region>
        <rname>Oregon</rname>
        <overlay>458/541</overlay>
    </npadata>
    <npadata>
        <npa>463</npa>
        <region>IN</region>
        <rname>Indiana</rname>
        <overlay>317/463</overlay>
    </npadata>
    <npadata>
        <npa>464</npa>
        <region>IL</region>
        <rname>Illinois</rname>
        <overlay>464/708</overlay>
    </npadata>
    <npadata>
        <npa>469</npa>
        <region>TX</region>
        <rname>Texas</rname>
        <overlay>214/469/972</overlay>
    </npadata>
    <npadata>
        <npa>470</npa>
        <region>GA</region>
        <rname>Georgia</rname>
        <overlay>404/470/678; 470/678/770</overlay>
    </npadata>
    <npadata>
        <npa>473</npa>
        <region>GN</region>
        <rname>Grenada</rname>
        <overlay></overlay>
    </npadata>
    <npadata>
        <npa>475</npa>
        <region>CT</region>
        <rname>Connecticut</rname>
        <overlay>203/475</overlay>
    </npadata>
    <npadata>
        <npa>478</npa>
        <region>GA</region>
        <rname>Georgia</rname>
        <overlay></overlay>
    </npadata>
    <npadata>
        <npa>479</npa>
        <region>AR</region>
        <rname>Arkansas</rname>
        <overlay></overlay>
    </npadata>
    <npadata>
        <npa>480</npa>
        <region>AZ</region>
        <rname>Arizona</rname>
        <overlay></overlay>
    </npadata>
    <npadata>
        <npa>484</npa>
        <region>PA</region>
        <rname>Pennsylvania</rname>
        <overlay>484/610</overlay>
    </npadata>
    <npadata>
        <npa>501</npa>
        <region>AR</region>
        <rname>Arkansas</rname>
        <overlay></overlay>
    </npadata>
    <npadata>
        <npa>502</npa>
        <region>KY</region>
        <rname>Kentucky</rname>
        <overlay></overlay>
    </npadata>
    <npadata>
        <npa>503</npa>
        <region>OR</region>
        <rname>Oregon</rname>
        <overlay>503/971</overlay>
    </npadata>
    <npadata>
        <npa>504</npa>
        <region>LA</region>
        <rname>Louisiana</rname>
        <overlay></overlay>
    </npadata>
    <npadata>
        <npa>505</npa>
        <region>NM</region>
        <rname>New Mexico</rname>
        <overlay></overlay>
    </npadata>
    <npadata>
        <npa>506</npa>
        <region>NB</region>
        <rname>New Brunswick</rname>
        <overlay>428/506</overlay>
    </npadata>
    <npadata>
        <npa>507</npa>
        <region>MN</region>
        <rname>Minnesota</rname>
        <overlay></overlay>
    </npadata>
    <npadata>
        <npa>508</npa>
        <region>MA</region>
        <rname>Massachusetts</rname>
        <overlay>508/774</overlay>
    </npadata>
    <npadata>
        <npa>509</npa>
        <region>WA</region>
        <rname>Washington</rname>
        <overlay></overlay>
    </npadata>
    <npadata>
        <npa>510</npa>
        <region>CA</region>
        <rname>California</rname>
        <overlay>341/510</overlay>
    </npadata>
    <npadata>
        <npa>512</npa>
        <region>TX</region>
        <rname>Texas</rname>
        <overlay>512/737</overlay>
    </npadata>
    <npadata>
        <npa>513</npa>
        <region>OH</region>
        <rname>Ohio</rname>
        <overlay>513/283</overlay>
    </npadata>
    <npadata>
        <npa>514</npa>
        <region>QC</region>
        <rname>Québec</rname>
        <overlay>438/514</overlay>
    </npadata>
    <npadata>
        <npa>515</npa>
        <region>IA</region>
        <rname>Iowa</rname>
        <overlay></overlay>
    </npadata>
    <npadata>
        <npa>516</npa>
        <region>NY</region>
        <rname>New York</rname>
        <overlay></overlay>
    </npadata>
    <npadata>
        <npa>517</npa>
        <region>MI</region>
        <rname>Michigan</rname>
        <overlay></overlay>
    </npadata>
    <npadata>
        <npa>518</npa>
        <region>NY</region>
        <rname>New York</rname>
        <overlay>518/838</overlay>
    </npadata>
    <npadata>
        <npa>519</npa>
        <region>ON</region>
        <rname>Ontario</rname>
        <overlay>226/519/548</overlay>
    </npadata>
    <npadata>
        <npa>520</npa>
        <region>AZ</region>
        <rname>Arizona</rname>
        <overlay></overlay>
    </npadata>
    <npadata>
        <npa>530</npa>
        <region>CA</region>
        <rname>California</rname>
        <overlay></overlay>
    </npadata>
    <npadata>